{
  "schema_version": 2,
  "task_id": "workspace-integration",
  "objective": "验证 HD、crosvm 和 gfxstream 在统一 MinGW 工具链下的宿主集成。",
  "status": "complete",
  "scope": {
    "repositories": ["hd", "external/crosvm", "hardware/google/gfxstream"],
    "owned_paths": ["hd/", "external/crosvm/", "hardware/google/gfxstream/host/"],
    "excluded_paths": ["out/", "target/", "third_party/minijail/"]
  },
  "constraints": [
    "do_not_run_unittest",
    "windows_uses_mingw_only",
    "preserve_user_changes",
    "do_not_push"
  ],
  "acceptance": [
    {
      "id": "INT-001",
      "criterion": "HD GNU 质量门通过。",
      "evidence": ["gate:hd-quality"]
    },
    {
      "id": "INT-002",
      "criterion": "crosvm Windows GNU 功能和测试目标编译通过但不运行测试。",
      "evidence": ["gate:crosvm-windows-gnu-check", "gate:crosvm-test-targets-compile"]
    },
    {
      "id": "INT-003",
      "criterion": "gfxstream backend 使用 MinGW 增量构建通过。",
      "evidence": ["gate:gfxstream-mingw-build"]
    },
    {
      "id": "INT-004",
      "criterion": "crosvm 与 gfxstream 当前 diff 不含 whitespace error。",
      "evidence": ["gate:crosvm-diff-check", "gate:gfxstream-diff-check"]
    },
    {
      "id": "INT-005",
      "criterion": "Windows gfxstream 录屏使用实际硬件 H.264 MFT 生成并复验完整 MP4，且清理临时产物。",
      "evidence": ["gate:windows-host-recorder-smoke"]
    }
  ],
  "required_gates": [
    "hd-quality",
    "crosvm-windows-gnu-check",
    "crosvm-test-targets-compile",
    "gfxstream-mingw-build",
    "windows-host-recorder-smoke",
    "crosvm-diff-check",
    "gfxstream-diff-check"
  ],
  "evidence_state": {
    "code_present": true,
    "tests_authored": true,
    "contract_smoke_verified": true,
    "real_guest_verified": false
  },
  "direction_decisions": [
    {
      "id": "D-TOOLCHAIN-001",
      "decision": "Windows 全链统一使用 MinGW/GNU，禁止 MSVC fallback。",
      "owner": "human",
      "rationale": "与 bscp 既有 Windows 工具链和 ABI 保持一致。"
    },
    {
      "id": "D-TEST-001",
      "decision": "只编译测试目标，不运行 unittest。",
      "owner": "human",
      "rationale": "遵守仓库当前测试执行约束。"
    }
  ],
  "blockers": [
    {
      "id": "B-REAL-GUEST",
      "description": "联合编译不代表真实 Android Guest、严格零拷贝和设备 profile 已完成三平台运行验收。",
      "scope": "external",
      "state": "accepted"
    }
  ],
  "human_decisions_needed": [],
  "next_iteration": "获得固定签名 bundle 与专用 runner 后，接入 real-guest、zero-copy 和 device-profile gate 并继续同一回读闭环。"
}
